,qid,docid,docno,rank,score,query,brand,model,text,clusters
181,q1,5500,d5501,181,6.492217155045677,bmw volk,Plymouth,Barracuda,"Plymouth Barracuda 1970 $45,000 1970 Plymouth Barracuda 396 SuperchargedBig Block 400 R Automatic Transmission Completely Customized Suspension Interior Exhaust Wheels Must see! Willing to transport anywhere in the USA $45,000",21
7,q1,2985,d2986,7,7.5135951438890025,bmw volk,Ford,Thunderbird M Type,"Ford Thunderbird M Type 1962 $24,900 This 1962 Ford Mcode Thunderbird hardtop has alloriginal equipment and only one owner, as reported by the seller. Power is supplied by a 390cid V8 and backed by an automatic transmission. The attached picture is a screenshot referenced from the ""Vintage Thunderbird Club International, Original Factory Specifications, Volume 4, November 2002"" magazine. As indicated, there were only 17 ""M"" code Hardtop models produced in 1962, ""seventeen"". That alone makes this car very rare. This car is a survivor and to my knowledge, all equipment on this car is original except items that would have been replaced due to normal wear. If the person that purchases the car desires, I still have all the parts I have had replaced. Features include a SwingAway steering wheel; power windows, door locks, and drivers seat; factory air conditioning; and 48spoke KelseyHayes chrome wire wheels. Many new parts have been installed including the tires, brakes, fuel pump, fuel lines, brake booster, spark plugs, and wires. This Rangoon Red Thunderbird with a reported 58,874 original miles and a white leather interior comes with receipts, parts records, and a clear title. My restoration efforts have all been focused on getting the car back in road worthy condition, which it is. I have not had any interior or exterior cosmetic processes performed on this car. This will allow the new owner to put their stamp on the car by performing only the work they want. This Rangoon Red Thunderbird hardtop reportedly still wears its factory chrome and stainless trim, emblems, and handles. The original headlights, grille, and bumper can be seen at the front. The factory bumper with integrated taillights and fuel door is mounted at the rear. The seller states a cosmetic piece at the bottom of the antenna is missing and there are spots of rust at the back wheel well. There is no rust on the underside of the car. A set of 14inch chrome 48spoke KelseyHayes wire wheels with tribar center caps are wrapped in 215/75/14 whitewall tires. The interior is furnished with original white leather front bucket seats with factory seat belts and a matching rear seat. This Thunderbird features the SwingAway steering wheel. With the transmission in park, the steering wheel and column slide 18 inches to the right, allowing the driver to exit the cabin easily. The steering column is topped with a threespoke white steering wheel with a chrome horn ring. The padded dashboard is white on the bottom and contrasting gold on the top, split by ribbed trim that flows down into the center console, which houses a 120mph speedometer, a clock, and a fuel/temperature gauge. The odometer shows 58,874, which the seller states is accurate. The engine is an Mcode version of the 390cid V8. The Mcode option featured three twobarrel Holley carburetors and produced 340 horsepower. Factory chrome valve covers, a finned openelement air cleaner, and new spark plugs and wires complete the engine. Factory power brakes, air conditioning, power steering, and a mechanical radiator fan can be found under the hood. According to the seller, it was originally purchased by the late Aurelbelle Shaffer, who was the wife of the late Raymond Shaffer, the former president of Greyhound. Aurelbelle drove this Thunderbird as her second car and always kept it parked under a carport in Scottsdale, Arizona. In 1992, the car was placed in a storage facility in Arizona and kept there until it was moved to Georgia in 2010. The car remains in a building and has only been driven very sparingly since 1973. Receipts for parts and service work will be included in the sale. $24,900",5
15,q1,3311,d3312,15,7.348440571169301,bmw volk,Chevrolet,Bel Air,"Chevrolet Bel Air 1954 $48,000 American automotive design from the 50s was one to behold, and what it lacked in performance, it made for in class and luxury. For instance, the design behind this 1954 Chevrolet Bel Air Coupe, dressed in a twotone red and white exterior, screams oldschool luxury and style and belongs on the sets of Hollywood. What makes this car stand out is its factory styling done to perfection; all its exterior trim is present and in excellent condition, with the current owner reporting new chrome trim. For that added factory appeal, this 50s beauty sits on its factory hubcaps that are wrapped with whitewall tires, with the driver having the option to finetune the ride height through an adjustable airbag suspension system. Matching the twotone red and white exterior is a matching interior. Like the exterior, the interior is factory spec and made to stand out and stay true to character. Step in, and you will find the car's interior components present and in great shape; you get A/C to weather those hot summer cruises and power windows and steering in place to make every drive effortless. Engine Considering the condition of this 1954 Chevrolet Bel Air Coupe exterior and interior, it's unsurprising that this American legend's engine bay is in mint condition. Open the hood, and you are treated to the sight of a 283ci straight six powertrain neatly nestled in and providing decent performance. The highlighting factor, however, is not the performance but how clean the engine bay is. Components like the carburetor and other mechanical components stand out, shine out, and are ready to be featured in any automotive magazine. Power is sent to the car's rear wheels in true oldschool fashion through a 3onthetree manual transmission. $48,000",5
42,q1,3181,d3182,42,7.190390288574131,bmw volk,Ford,Thunderbird,"Ford Thunderbird 1957 $89,500 Completely restored by Amos Minter in Dallas Texas. Minter is well known for his restorations of the Thunderbirds and highly acclaimed for his work. This 1957 Thunderbird as only 6715 miles since being completely restored. This 57 comes with both tops which both are white, Celsy Haze factory wire wheels, factory A/C installed by Minter. This 1957 Thunderbird is in absolute showroom condition inside and out after being completely restored by Minter whowill not even restore one for less than $100,000. Everything is in perfect working condition, motor and transmission are in perfect working condition. $89,500",5
45,q1,3218,d3219,45,7.190390288574131,bmw volk,Ford,Super Deluxe,"Ford Super Deluxe 1941 $57,500 1941 Ford Super Deluxe Station Wagon w/ Matching 1953 Fleetcraft Clipper Runabout Boat w/ 15hp Evinrude Fast Twin Outboard 1941 Ford Super Deluxe Station Wagon is in largely original, not restored condition. 9,485 Super Deluxe Station Wagons were produced in 1941. Mileage shows as 98,052 which is believed to be correct. The wagon spent its life up until late 2019 in Virginia. I am the 5th Owner. It has one repaint in the original Loch Haven Green color which matches the trim tag. There is no rust in the body. There are photos included of the wheel wells showing this. The wood is original except for some small repairs, and is in good condition. The fabric top was replaced within the last 15 years, and is in good condition. A set of metal drip edges for the top were acquired by the previous owner after the top work was done. He felt that the edging was well done when the top was replaced & did not justify tearing it up to install the steel ones. They are included in the sale. Mechanical: At some point before the previous Owners purchase a Ford 8BA flathead V8 was installed. He installed a new radiator, shroud, & Drake high efficiency water pumps, and it runs cool even on hot Savannah days. He had the car rewired including a plug for the boat trailer. The boat trailer currently does not have lights or wiring. A vintage turn signal kit was installed when the wiring was done, & it works great. All lights & the horn work. The radio & gauges were rebuilt when the wiring was done & they work fine. Previous owner replaced the gas tank, generator, voltage regulator, carburetor, and stock lever action shocks. Since purchasing the car I have installed a Pertronix ignition system w/ Pertronix plug wires and coil, new spark plugs, a new alternator charging set up, all new Bendix/Self Adjusting brakes on all 4 wheels, and a new 6 volt battery. Interior: The wagon has all 3 seats. The leather seating surfaces are in excellent condition with no visible wear, rips, etc. I installed all new rubber floor mats from front to rear with insulation. I also installed new interior & exterior mirrors, sun visors, and rear window hardware. The previous owner installed new dash plastic, & rebuilt the gauges & radio. Chassis & undercarriage As stated above the brake system was replaced with Bendix/Self Adjusting drum brakes. The mufflers were replaced with new glass pack units received when the car was purchased. The dual exhaust system is tight and not objectionably loud. There is an electric fuel pump near the tank that has been replaced under my ownership, & it works fine. Other than mild surface rust & grime the chassis is in fine condition. There are no noted leaks from the brake system. The tires are relatively new Coker radials that are in good condition. Driveability I keep a 6 volt Battery Tender on the car, and it starts easily, comes to an easy idle with some use of the choke, warms quickly, and drives out with no problems. Lets face it this is an 82 year old vehicle that is built more like a piece of furniture than a modern car! Steering does not shimmy but can be somewhat vague. Brakes, even w/ the Bendix units, are not 4 wheel discs. Leave room in traffic! 1953 Fleetcraft Runabout & 15hp Evinrude Outboard Boat: from what I can find 1953 may be the first year that Fleetcraft made a fiberglass hulled boat. There is no data plate or serial # on the boat. The previous Owner bought the boat at an auction in PA, which makes sense since Fleetcraft boats were originally made in SE PA. He bought it because the hull color is such a good match w/ the wagon, plus the wood deck & interior. The hull, wood deck, & interior are all in great shape, and do not require any current work. Evinrude Fast Twin 15hp outboard can be identified as a 19531954 model from the Serial #1501201914. Since I had no plans to put the boat in the water I put oil in the cylinders, pulled it through a few times, & have not attempted to start it. There is a 6 gallon portable fuel tank that goes with the sale. Trailer: I replaced the tires, tubes, and wheel bearings. Installed a trailer dolly to aid in storage. Fun Fact: The last two years, 2021 & 2022 I have been invited to bring the woody & boat to the Hilton Head Island Concours dElegance for their 2 day On the Water display of antique water craft. They got a lot of attention! $57,500",5
51,q1,3424,d3425,51,7.190390288574131,bmw volk,Chevrolet,Bel Air,"Chevrolet Bel Air 1957 $85,000 57 Chevy 2dr. Belair Post, Powered by a 350 ci LS with a BBK SSI Single Stage Induction Manifold along with a Kwik custom front runner Serpentine belt system to handle the Vintage A/C and the P/S. Included in the power train is a 4L60E auto trans w/overdrive, completely rebuilt with all billet and forged internals in 2019. An Aluminum radiator w/electric fan takes care of the cooling. A custom made 9 Limited slip 371 geared differential w/Chevy tube ends is included. Hydroboost4 Wheel power disc brakes installed in May 2023, 12 Front and 11 Rear. 20 gal. custom stainless gas tank, by Valley. Chevy front bucket seats. Chevy center console, Electric windshield wipers w/delay, Driver and Passenger power windows, Keyless vehicle entry, Pioneer stereo radio w/disc player w/remote, Classic electronic instruments, 16 American Racing Wheels, Custom free hand pin stripping that includes some 24 caret gold flake. The original idea for this vehicle was to do a traditional style frame off restoration. That project was under way when 911 happened, which is why it has the design that it does. This vehicle was build to be driven, daily if you so desire, that is what it is for, to drive, and have fun, not to just be parked and looked at. When I drive the car I always get the thumbs up sign from other drivers and pedestrians. The car is a magnet. And it's fun to show it off even though it's more fun to drive. The picture section depicts the two prior stages the vehicle was in prior to its road to completion. The Sierra Gold pictures show the condition when the car was acquired and restoration started The prime photo's show in stage body work and then the finished product. Included with the car is all of the invoices of work performed and receipts of parts purchased that I kept while on this mission. I have not added up the total of all the paper work that now fills a 3 binder. I also have a complete FMV appraisal done 10/2023, that will come with the car. $85,000",5
68,q1,4056,d4057,68,7.190390288574131,bmw volk,Jeep,Grand Wagoneer,"Jeep Grand Wagoneer 1987 $72,000 This 1987 Jeep Grand Wagoneer has been mechanically and cosmetically refurbished by Wagonmaster of Kerrville, Texas, during previous ownerships. The truck is finished in white with fauxwoodgrain trim over Cordovan leather and cloth, and it is powered by a Jasper 360ci V8 that is equipped with a fuel injection system according to seller, who acquired the vehicle in 2017 and spent two years being restored by Wagonmaster. Amenities includes a threespeed automatic transmission, 15 multispoke alloy wheels, a roof rack, a powerretractable rear window, poweradjustable front seats, air conditioning, and a Kenwood SiriusXm stereo with Bluetooth. This Wagonmaster shows 151,372k miles and is now offered in Texas with a clean Carfax report and a clean Texas title. The truck is finished in white with Wagonmaster pinstripes and fauxwoodgrain trim, and it features a Sirius XM satellite radio receiver, fog lights, an electric rear window, and a brightfinished roof rack, bumpers, mirror caps, and trim. The cabin features Cordovan leather and cloth seat upholstery as well as a colorcoordinated dashboard, carpets, and door panels. Amenities include poweradjustable front seats, a folding center armrest, heat / air conditioning, cruise control, and a tilt steering wheel. The twospoke leatherwrapped steering wheel frames a 100mph speedometer and two combination gauges for fuel level, coolant temperature, oil pressure, and voltage. The 360ci V8 was replaced in 2017 during the second renewal process by Wagonmaster along with interior and exterior details. The Carfax report shows no accidents or other damage and lists history in Texas since deliver in July of 1987. $72,000",5
84,q1,4851,d4852,84,7.190390288574131,bmw volk,Chevrolet,Antique,"Chevrolet Antique 1928 $18,900 Or best offer Priced Reduced reducing collection The 1928 Chevrolet Series AB National isall steel and bathed in green for the body. It has a louvered cowled hood, and a shiny chromed radiator surround complete with a glass tube radiator water gauge that measures any potential overheating. A single round headlight in a black dish styled casing hangs on either side by a steel bar that stretches from fender to fender. Factory gas gage, factory Landau roof,spoke wheels, factory high end wooden steering wheel.9602 miles showing on original factory gages andeasy starting.Beautiful hunter green exterior with complimentary camel wool seating in new condition, spare tire mounted on rear compliments classic look. Within the cowled hood is a working 174ci inline 4cylinder engine.It has a 1barrel carburetor and a 3speed manual transmission. A 4.18 rear axle takes the 35 horses it produces and puts it to the ground. Runs and drives like new.Totally restored.Chrome in perfect condition.Title in hand.Owned in museum collection for over ten years in a climate controlled environment, instaff mechanics maintained. Contact us to schedule a liveFaceTime video call. $18,900",5
125,q1,5974,d5975,125,7.190390288574131,bmw volk,Kaiser,Manhattan,"Kaiser Manhattan 1953 $14,000 Two Tone Exterior Kaiser Manhattan. With Blue Top Two Tone Interior Manual Column Shift Fender tag and Vin tag both in place. has Aux temperature gauge. Has had some new wiring and new fuel pump installed. Runs and Drives. Has normal wear and tear. chrome pitting, minor delamination on windows. some minor dings/damage to chrome molding Taillight lenses showing signs of wear. cracking, fading. Minor paint fading driver side fender. Small dent front bumper, lower. Have a video of engine running. also will have Detailer shampoo/detail the seats/ interior so can send that upon request. $14,000",5
142,q1,3099,d3100,142,7.038995550444425,bmw volk,Chevrolet,Fleetmaster,"Chevrolet Fleetmaster 1948 $59,000 1948 Chevrolet Fleetmaster Convertible The Chevy Convertible was produced from 19461948. This beautiful 1948 example has had a frame off restoration from a rust free car and has only been driven 219 miles since. The frame has been powder coated. It is equipped with a 350ci, tuned port fuel injected corvette engine, 700r4 automatic transmission with overdrive and a 9"" Ford rear. Additional options include, Ford sub frame power rack and pinion steering, front power disk brakes, Vintage Air heat and air conditioning, Flaming River tilt steering column, all matching gauges by Dolphin, AM/FM radio concealed in glovebox, Ostrich leather interior, triple plated chrome, including interior top arms, Cragar SS mag wheels, Flow Master exhaust, electric front windows, tinted glass, and electric wipers. $59,000",5
153,q1,4054,d4055,153,7.038995550444425,bmw volk,Shelby,Cobra,"Shelby Cobra 2011 $50,000 Magnificent build, stellar craftsmanship on this vehicle. two inch thick stack of build documentation, car is one of the best builds you'll find. simple, clean and mean. specs are available and incredible. top quality components throughout. Two professional appraisals valuing the car at 90k Canadian dollars. Factory FiveRacing Propelling this serpent is acustombuilt, fullypolished 428FE crate motor with all the bells &whistles and over 500 horsepower. The hardbodied persona and the mean, throatysound of this black mamba elicits multiple honks and thumbs up every time itson the road. Never fails to put a smile on my face every time I cut er loose. Canadian titled and registered: Under theHood Theengine compartment componentry includes: castiron ceramicsilvercoated4 into 1 headers polishedSS GASN Performance sidepipes SSbraided fuel & oil lines highperformancealuminum radiator highflow16 thermostaticallycontrolled radiator fan with manualoverride Gear Train rugged Ford8.8 rear end 31spline 10.375 driveshaft The custom cockpit in this iconic road reptile is outfitted with: Legacyreproduction Cobra blackfaced gauges with correct reversereading speedometer leathercladdash 14leatherwrapped removable richblack & tan Italian custom leather upholstery and door skins includingheated seats richblack wool carpeting customembroidered windwingsand tinted sun visors underdashfuel cutoff switch, horn, electric fan controls, and LED under carriage lights Rolling Stock Chassis, Suspension, Brakes Legendfaithful,4 round tube framejust like the 1960s original CSX cars and fullypowdercoated fullyindependent suspension front & rear, employing fronttubular control arms Other Particulars dualchromed rollbars and hardware hiddentrunk hinges triplechromedquick jacks front & rear trunkmounted,concealed underfloor trunkaccessible everypiece of metal/tin used on the build was professionally powder coated includingcustom build wheel wells and transmission tunnel custombuiltfresh air vents with dampers in footboxes entirebody was undercoated in boxesof parts for the next owner to add their flare to the car including stainless bulletside mirror, chromed fire extinguisher, chromed wiper box, chromed custombuiltmesh for front body openings customcar cover included 100%new part build as you will see from the receipts and comes with fully certifiedappraisals. You also get: Vehicle currently in deluxe storage in Edmonton, CA. $50,000",5
161,q1,5145,d5146,161,7.038995550444425,bmw volk,Chevrolet,Corvette,"Chevrolet Corvette 1960 $75,000 1960 Chevrolet Corvette Convertible ,Frameoff Restoration, Replacement 350ci Chevrolet small block V8 engine, original Borg Warner T10 4speed manual transmission, front disc brakes, and rear drum breaks, Flaming River steering column, smaller diameter steering wheel, TascoTurquoise exterior, matching turquoise interior, removable hardtop, dashboard redone back to original, original seats, original gauges, original glass, original rear end, original door panels, new 18 inch Coys wheels, and new tires. This car is a driver and it has no oil leaks. The car needs a little TLC to the stainless, to the side and rear windows. The front window is new. The front bumpers and grill is new. The rear bumper needs to be rechromed. Its ready to go. Drives good. $75,000",5
191,q1,1649,d1650,191,2.7990615915353807,bmw volk,Mercury,Monterey,"Mercury Monterey 1962 $34,995 This 1962 Mercury Monterey Custom convertible is finished in red and white over colorcoordinated leather upholstery and powered by a 390ci V8 mated to a twospeed automatic transmission. Features include a poweroperated white convertible soft top, pushbutton AM radio, electric windows, shave door handles and mirrors, a lowered suspension, power steering, American racing wheels, powerassisted front disc brakes, and a dual exhaust system with chambered mufflers. The car was acquired by the selling dealer in 2020. This Monterey convertible is now offered with a clean Colorado title. The body is finished in red and white and features a poweroperated white convertible soft top. Equipment includes quad headlamps, chrome trim and bumpers, rocketstyle taillamps, fendermounted wind splits, vent windows, and a dual outlet exhaust system that exits below the rear bumper. The door handles and mirrors have been shaved. The 17 American Racing Torq Thrust wheels are mounted with 245/45 Kenda front tires and 275/60 Goodyear Eagle GT II rear tires. The car is equipped with a lowered suspension and power steering. Braking is handled by powerassisted front discs and rear drums. The front and rear bench seats are upholstered in red leather with white accents and are joined by a colorcoordinated dashboard, door panels, and carpets. Equipment includes electric windows, a heater and defroster, and a pushbutton AM radio. The threespoke steering wheel has a chrome horn ring and frames a 120mph speedometer and gauges for fuel level and coolant temperature. The fivedigit mechanical odometer shows 47k miles. Total mileage is unknown. The 390ci V8 breathes through a fourbarrel carburetor and features an Optima redtop battery and gold air cleaner and valve covers. An oil change was performed in 2022. Power is delivered to the rear wheels through a twospeed automatic transmission. A dual exhaust system with chambered mufflers is installed. The serial number reveals that the car is a 1962 Monterey Custom Convertible built at St. Louis, Missouri plant and was powered by a 352ci V8. The data tag above further decodes as follows: $34,995",5
11,q1,4291,d4292,11,7.5135951438890025,bmw volk,Dodge,Charger,"Dodge Charger 1973 $35,000 1973 Dodge Charger, 440 engine, 4bbl, Automatic transmission One owner vehicle Never in an accident, but car was damaged on right side by hit and run while car was parked in a parking lot. Had it repaired locally New tires, belts and plugs Some repairs need to be done to vinyl top , driver's seat, top of back seat Hasn't been driven in about a year on public roads.Cranked and run regularly every few days. $35,000",23
12,q1,4468,d4469,12,7.5135951438890025,bmw volk,Ford,Thunderbird,"Ford Thunderbird 1963 $28,500 The car was rebuilt in the fall of 2005.The engine 4 barrel carb. and transmission along with all new leaf springs ,andcoil springs in the front.. New shocks front and back . new interior seats, rugs along with headliner. In 2020 I had all gas , brake lines replaced with Stanless Steel.It was in a car magazine in 2012.The car is a driver not just to set and look at it. The car is being sold as is, do to health reasons and down sizing. This is a great car , it's always been stored in a garage along with a car cover . It's never been driven in the winter sence it was restored in 2005. As you can see in one of the picture that it was featured in a car magazine in August of 2012. $28,500",23
21,q1,928,d929,21,7.190390288574131,bmw volk,Cadillac,Convertible,"Cadillac Convertible 1951 $99,500 1951 Cadillac Series 62 2Dr convertible 33,133 mile original car This Cadillac is a rare, low mileage, original survivor. The paint, chrome, leather interior, and even the convertible top and boot are original. The car comes with the original bill of sale including the upgrade to U.S. Royal Master tires and tubes that are still on the car. Extras include Seek and Find radio with both WonderBar and push button floor controls, power windows, driver's seat, and convertible top, Cadillac script vanity visor mirrors, and chrome Kleenex tissue dispenser. The original spare, jack, tool kit, and jack instructions are in the trunk, clock and heater instruction cards, owner's manual, Cadillac Shop Manual, wiring diagram, A.E.A. Tune Up System specifications, and new car cover are included. The car was recently serviced by a master mechanic, has fresh oil and filter, and is ready to be driven enjoyed. Please come take a look. This beautiful automobile speaks for itself. $99,500",23
