,qid,docid,docno,rank,score,query,brand,model,text,clusters
2,q1,2855,d2856,2,8.378910293325697,bmw volk,Chevrolet,Nova,"Chevrolet Nova 1967 $129,000 1967 Chevy Nova Resto Mod Please see links for videos! https://youtu.be/CH5QSq6PJ_0 https://youtu.be/J0CZ4ibRF9o https://youtu.be/uvkMi_4cIZ8 https://youtu.be/vIXaEDLQze I have just have a few too many cars and have decided to sell a few. This is built on a chassis works complete frame with a ProTouring/Pro street setup, this Nova is powered by GM Crate 502 and has had an upgraded cam and lifter installed at around 900 miles. Total miles at this time is only 1650 miles. It also has a new tremec 5speed manual transmission that was installed at about 900 miles. This car recently had an upgrade in the march serpentine compete kit and new vintage Air. It has slotted For more information feel free to call or text 5018440000 I have accumulated way too many cars and I am just moving a few. See below for the full build list on this awesome Nova. Build list: Upgraded cam/lifter springs at approx 900miles 5speed tremec transmission 900 miles Chassis works 4 Link setup $129,000",26
50,q1,3421,d3422,50,7.190390288574131,bmw volk,Pontiac,GTO,"Pontiac GTO 1966 $119,900 1966 Pontiac GTO 455 HO Tri power 455 CI/375 HP. links to youtube videos: Under Hood: https://youtu.be/ehQQAGJyqj4?si=cHYvKuBE2x3jKGFa Exterior: https://youtu.be/KsbC5iatYlg?si=NxQwVmBnxATjM3f8 Interior: https://youtu.be/4hlSctDypM?si=fkDrvj48LymYW0DI Startup and Idle: https://youtu.be/FWps8VOSS0M?si=_CntklRHmwAF55B $119,900",26
140,q1,3065,d3066,140,7.038995550444425,bmw volk,Pontiac,GTO,"Pontiac GTO 1967 $74,900 Imagine pulling up to the drivein in what may be the only numbers matching, 1967 Purple Goat. This award winning 67 GTO Hardtop Coupe was ordered from the factory with special metallic paint Plum Mist and factory air. While this was a GM color, Pontiac stopped offering plumb mist on the GTO in 1966. Born in Pontiac, Michigan on October 31st, this special order GTO was delivered to Smith Motor Company in Laurens, South Carolina. Years later the car was found abandoned in a Texas auto body shop, when it later underwent a complete frame off rotisserie restoration in 2016. The car has its numbers matching Pontiac 400 4bbl with 335hp, threespeedTurboHydramaticTH400, which was equipped with aHurst Performancedualgate shifter, called a ""his/hers"" shifter, that permitted either automatic shifting in ""drive"" or manual selection through the gears. Everything works as it should and it is documented that the car has been driven less than 2600 miles since restoration. It has always been stored in a climatecontrolled garage. The car comes with restoration documentation as well as Pontiac Historical Societys documentation of the special paint code and window sticker. It received the Restored Auto award at the 2021 Good Guys car show. All sheet metal is original other than the hood which was purchased after the original was damaged by the sand blasting process. The exhaust and headers were replaced during restoration and provides a great rumble from the stock 400. Designed by John DeLorean, the Pontiac GTO is considered of the most desirable cars of the muscle car era. The 1967 is often considered the most desirable, featuring sleek design updates to the hood, grill and taillights. I am sad to see my baby go, but it is time to turn over the keys and let someone else enjoy this classic icon of American car history. $74,900",26
5,q1,2730,d2731,5,8.107962489934165,bmw volk,Chevrolet,Camaro Z28,"Chevrolet Camaro Z28 1996 $15,000 1996 CAMARO z28 Pampered and Well Maintained. A GREAT INVESTMENT! VAROOM!!! LT1, 5.7L, 8 Cylinder SEE PICTURES OF CLEAN UNDERCARRIAGE AND ENGINE! A 4th generation Camaro with no rust, original owner, no accidents, always garaged, meticulously maintained. A small chip size dingsatfront tip of bumper, which I touched up. A GREAT INVESTMENT! Serious Buyers Only, Please. CLEAN / WELL MAINTAINED / PAMPERED All parts replacements have been kept up to date and current. Just replaced plugs as a courtesy because I was replacing a hose in that area. My z28, is in Amazing Shape. LOOKS LIKEIT JUST DROVE OFF THE SHOWROOM FLOOR! Inside like new. Virtually 'NO Wear.' Outside is Bright, Shiny ...and Beautiful! STANDARD EQUIPMENT: SAFETY / SECURITY: EXTERIOR: INTERIOR: z28 PREFERRED EQUIPMENT CITY MPG 17 / HIGHWAY MPG 25 $15,000",36
88,q1,4952,d4953,88,7.190390288574131,bmw volk,Chevrolet,C/K 10,"Chevrolet C/K 10 1977 $30,000 New paint job. Runs great $30,000",36
91,q1,4977,d4978,91,7.190390288574131,bmw volk,Chevrolet,Camaro,"Chevrolet Camaro 1979 $30,000 Factory installed manual transmission, mint interior, 45000 original miles. All numbers match. Garage kept. Exhaust manifold removed and replaced with headers, am/fm radio replaced with CD player. All else original $30,000",36
0,q1,2740,d2741,0,8.557644703913523,bmw volk,Lola,T-70,"Lola T70 1967 Best Offer 1967 Lola T70 Mk3, SL73/109. ALERT!!! Injection to Weber carbs. ALERT!!! The car is now being converted to Weber Carburetors, and a new HTP will be applied for. Hopefully in a few months it will be ready to go. For watchers, please note: 18636199765, The Lola T 70, Mk III, SL73/109 was delivered new as a Mk3 spider to John Mecom, the US Lola importer, on March http://www.racingsportscars.com/chassis/archive/SL73__109.html In In Richard Dodkins fitted a Mk3 coupe body by Clive Robinson, with no central white stripe, using a 6.3L Chevy engine, he completed the Lola. He then did extensive racing in England, Europe, and USA, together with sponsorship by AT&T. In https://www.motorsportmagazine.com/archive/article/september1996/57/canamreunion/ https://www.youtube.com/watch?v=asIn3wtlxg Video of reunion, @ 5:37 mins. Also fleeting @ 0:21, 6:24, 6:51, 8:08. https://www.youtube.com/watch?v=pBgqph89Fy0 Video of reunion, @ 1:48. He sold Lola in I purchased the Lola in 2017 from Portugal, subsequently, my plans changed, I have not raced or tracked the Lola since purchase, but well cared for. As can be seen from the above, SL73/109 has a continuous solid history from new The car is carrying a 5liter small block Chevy, but the Lucas injected engine currently being converted to Weber carbs. The Lola has only 3 race hours under its belt. The LG600 5speed gearbox has been completely overhauled with all new gears, dogs, and bearings. Spares consist of oil coolers, rear suspension arms, drive shaft CV joints, windscreen, and a host of miscellaneous items. The car has six wheels for Masters, 3 fronts 10, 3 rears 12, all with Avon's. The car also has 4 wheels for Peter Auto, 2 fronts 9, 2 rears, 12, with 2016 Avon's uninstalled. An impressive, longterm ownership Lola T70 Mk3. http://www.lolaheritage.co.uk/2018/register/t70/Astley/vaughn_astley.html See October 2018 Motor Sport magazine for great article on Lola T70 1967 Lola t70 SL/73 109 Race History. 19670423 Aztec Racing Team Mexico, Las Vegas GP, USRRC, M.Solana, #99 5th 19670430 Riverside GP, USRRC, M.Solana, #99, 8th 19671204 Mexico City Puebla Road Race, M.Solana, #99,1st 19671211 Cuernavaca, Mexico, M.Solana, #99, 1st 19680225 PachucaChico Hillclimb, Mexico, M.Solana, #99, 1st 19680331 Mexico City USRRC, M.Solana, #2, Rtd 27 Laps, Suspension 1970 Tiger Racing Team Panama, Panamanian Grand Prix, S. Taylor, 1st 19950521 Donington, R. Dodkins, #23, 19950611 Nrburgring, R. Dodkins, #23, 4th 19950702 Brands Hatch, R. Dodkins, #23 19950715 Oulton Park, R. Dodkins, #23 19950813 Nrburgring, W. Steding, #23, 10th 19950820 Zandvoort, R. Waaijenberg, #23, 9th 19951001 Brno, W. Steding, #23, 11th 19960428 Monza, W. Steding, #23 19960512 Spa, W. Steding, #23,1st Gp B 19960623 Nrburgring, R. Dodkins, #23, 3rd Gp B 19960721 Road America, R. Dodkins, #23, 13th 19960901 Donington, R. Dodkins, #23 1st Gp B 199609xx Road America, R. Dodkins, #23, 1st Gp B 19960929 Brno, W. Steding, #23 19970505 Silverstone, R. Dodkins, #23 19970601 Donington, R. Dodkins, #23 19970803 Zandvoort, R. Dodkins, #23, B 7th 19970810 Nrburgring, R. Dodkins,#23 19970914 Brno, W Steding, #23, B 6th 19980517 Monza, R Hyett, #23, 1st Gp B, 4th 19980524 Spa, R Hyett, #23, 19980524 Most, R Hyett, #23, 1st Gp B 9th 19980719 Donington, R Hyett, #23 19980809 Nrburgring, R Hyett, #23, 1st Gp B 2002 0420, ACDME I Circuit at Estoril, 1st 2002 ACDME.II Circuit at Braga, 3rd. 20020511, Circuit De Vila Do Conde, Zurich, 1st, and 2nd. 20030902, ACDME III Circuit at Estoril, 20050710 Circuit at Boavista, Oporto, Amaral, #301, 1st 2007March Test at Estoril. 2008072 to 5 Tests at Estoril. 20081108 Circuit Automvel do Algarve, Amaral, #320, 1st. 20090712 1st race G.P. Histricos do Porto , Amaral, #355, 1st. 20090712 2nd race G.P. Histricos do Porto , Amaral, #355, 2nd. 20110618 G.P. Histricos do Porto , Amaral, #301 2013 May, Sept, October Tests at Estoril, & Jerez, #85. 2015March Test at Estoril. 20151008 Circuit Automvel do Algarve, testing, #65 2016April Test at Jarama, Car missed deadline to enter, race full. Best Offer",16
46,q1,3223,d3224,46,7.190390288574131,bmw volk,Oldsmobile,442,"Oldsmobile 442 1969 $99,900 BEAUTIFUL 442 Convertible! 58k miles Electric convertible with brand new motor, brand new adjustable suspension, all new breaking system, all gauges operational, push button gear splitting system, original engine, original rims available ONEOFAKIND paint job AMAZING SHOW CAR SERIOUS INQUIRIES ONLY $99,900",16
52,q1,3437,d3438,52,7.190390288574131,bmw volk,Chevrolet,K-20,"Chevrolet K20 1969 $23,900 1969 K20. Built for son but the motor blew. New paint, stereo, suspension, upholstery, glass, tire and wheels, and many more extras. Has factory A/C but unsure of condition. Manual transmission. $23,900",16
58,q1,3657,d3658,58,7.190390288574131,bmw volk,Ford,Mustang,"Ford Mustang 1967 $23,000 Nice Mustangwith many extra's from an original 1967 Shelby. Carwas restored in 1998 andappraisal value from then at $22,500.Values have increased since then but has paint showing age. More information call me at 559760 2135. I am the second owner since 1998. I have decided to keep my 1968 fastback mustang I am focused tofinish. FEATURES 302 2V, extra 302 included 9"" differential 3.00 gears traction bars rear stableizer front power disc brakes rear drum SHELBYtuned suspension C4 Auto Trans SHELBY front end and hood ALL NEW Edelbrock double roller timing chain and gears water pump and thermostat fuel pump lifters rebuilt carburetor exhaust system and Flowmasters air cleaner steering wheel dash top American Racing Wheels $23,000",16
117,q1,5886,d5887,117,7.190390288574131,bmw volk,Chevrolet,3600,"Chevrolet 3600 1956 $29,900 1956 Chevy 3600 3/4 ton custom flatbed dual axle pickup with less than 6k on rebuilt 265 motor. Straight body, no dents, all glass and seals intact, doors aligned. Removeable side and rear stakes, ratchet tie downs, extra gas tank and undermounted utility/storage box. $29,900",16
130,q1,6180,d6181,130,7.190390288574131,bmw volk,Mercury,Cougar,"Mercury Cougar 1969 $70,000 1969 Cougar Eliminator with 78000 miles in Competition orange with Marti Report, original invoice and other related collector brochures. Option: INTERIOR: Seats are the original 1969 black comfortweave . EXTERIOR: All glass is clean and scratch free. Drivetrain and Chassis: The 351 has been updated with Edelbrock performer heads, crane cam, lifters, roller rockers with an offenhauser intake and header producing a whopping 450+ horsepower. The distributor was updated to a MSD Electronic with a tachometer convertor to utilize the factory tach. ** There also a parts car included 1969 Cougar sports special with complete drivetrain car had 21000 miles when parked** $70,000",16
1,q1,2743,d2744,1,8.48115101174542,bmw volk,Chevrolet,Nova,"Chevrolet Nova 1967 $229,000 1967 Promax Venom body #19 Chevy II Nova Pro Street Pro Touring This is not the Kindigit car everyone asks. This one was built right before their build. If This is one of approx. 30 manufactured. I was lucky enough to find another cab & chassis shortly after i found this car. I'm currently in the process of building. If Ihad not found another cab & chassis, I I searched for 7 years to find one of these cars! I am open to trades! Novas, Chevy II, etc... . I can trade up or down! The brakes are drilled and slotted & Chromed Calipers. It has huge wheels from Boze & Colorado Customs. This car will stop and changes directions like a cat with tennis shoes on. Kind of like two cars in one. It handles so well like pro touring. Easy to drive & goes straight like a pro street! The car is a blast to drive and always runs at 180 degrees no matter the outside temperature. Has approximately 2700 miles on it. There is a switch in center slide console that will control how much boost the car runs. It's set up normally at Engine Specs: 406ci Dart Little M Callies racemaster crank CompStar Rods 8.5.1 Compression Billet customer roller cam two turbonetics t66 Qtrim turbos Racegates Raptor BOV'S Customer intercooler, Big Stuff 3 EFI 83Lb Injectors, Hogans sheet metal intake, Billet specialties trutrac runner with vac. Callies racemaster crank, CompStar rods, JE 8.5.1, Billet custom roller cam, 2 Turbonetics t66 Qtrim turbos, Racegates Raptor BOV's custom intercooler, Big Stuff 3 EFI 83lb injectors, Hogans sheet metal intake, Billet Specialties trutrac front runner with vac. pump and Vintage Air A/C, PTC TH 400 manual valve body, 9'' PTC convertor 3.50 Yukon gear. DRIVE LINE: Trilink 4 bar, antiroll sway bar Fab 9 rear end Baer brakes drilled and slotted and calibers are chrome. INTERIOR: Custom leather two tone interior by ''Interiors by Shannon'', Alpine and JL audio sounds. Just send me an email or you can call me on my cell 5018440000. I also have a set of black bumpers and grill. If interested i also have photos of all the different rims that I've had. Serious inquires only please!! Once again I'm open to trades up or down! I will ship anywhere in the continental United States $229,000",0
87,q1,4927,d4928,87,7.190390288574131,bmw volk,Dodge,Dart,"Dodge Dart 1965 $117,500 1965 Dodge Dart 270 Hardtop Restomod. Solid California car sold new in Glendale California at Glendale Dodge. The car spent its entire life in California until 2016, it was purchased and shipped to Tennessee to start its restoration. This car was built by Hodge Restorations in Inman, South Carolina and finished in 2019. The car was completely stripped, interior & exterior and taken down to metal, all rust cut out and replaced with new metal and brought back to its current state. Meticulously painted with Sikkens Automotive Seafoam Turquoise exterior, all trim pieces on the car have been straightened & polished or replaced. The interior is done in Metallic Fawn color. Upholstery is by Legendary Auto Interiors LTD. All gauges restored and updated for the original look. Retro Radio, Bluetooth & Satellite radio equipped, Custom Auto Air AC system. This Dodge Dart is equipped with a Reilly Motorsports Suspension front & rear, including tubular upper & lower control arms, RideTec Coilovers , Flaming River rack & pinion steering, 4 link rear with Moser Engineering 9 differential & 3:00 Richmond gear, mini tubbed. Wilwood Drilled & Slotted 4 wheel Disc Brakes. Riding on Billet Specialties Wheels, 17x7 front & 17x10 rear, Nitto tires 225/45/ZR17 front & 285/40/ZR17 rear. This Dodge is equipped with a M & E Engine out of Shelby, North Carolina, 5.7L Gen 3 Hemi, .030 over, with MSD Hemi6 controller, Holley Sniper fuel injection, OC Performance intake, March Performance StyleTrac pulley system, Stainless Headers & Stainless 2 1/2 dual exhaust with MangaFlow mufflers, mated to a Street Stall 727 automatic transmission with 2000rpm stall converter by A & A Transmission out of Camby, Indiana. No expense was spared on this incredible Dart. Complete Frame Off Professional Restoration, less than 3000 miles on the build, this car is as clean underneath as it is on top! The car was featured in Modern Rodding Magazine, December 2022 issue. This awesome Dart is ready to be shown or driven! $117,500",0
90,q1,4975,d4976,90,7.190390288574131,bmw volk,Chevrolet,Nova,"Chevrolet Nova 1967 $130,000 This 1967 Chevy Nova received a rotisserie restoration and is powered by a custom built 383 ci V8 LS3 stroker motor with Trick Flow aluminum performance heads, March Performance pulleys, polished fuel injection intake and Abear coil covers. Power is transferred through a Tremec 6speed manual transmission that has been matched to a narrowed Ford 9inch posi differential with 3:73 gears. The engine bay has a smoother firewall, billet hinges and an aluminum radiator. It rides on a 4 link suspension with coil overs on all four corners, TCI subframe components and sway bar, chrome tubular control arms, rack and pinion steering and Wilwood disc brakes at all four corners. Aluminum fuel tank and all stainless exhaust. Interior done by Ronnie Mangus which consists of 4 Tesla bucket seats modified for installation with all power working. Vintage air, tilt steering wheel, push button emergency brake and AutoMeter gauges. The rear minitub allow for Billet Specialty wheels. $130,000",0
98,q1,5125,d5126,98,7.190390288574131,bmw volk,Willys,2-Dr Coupe,"Willys 2Dr Coupe 1941 $68,000 1941 willys coupe recent build. has best of everything.454 super charge punched out to 468.new cam, pistons. crank heads rebuilt.r400 transmission.4"" aluminum drive shaft strange rear end and axles. stainless aars, stainless borla mufflers and exhaust. stainless steel 4 link suspension. alden chrome adjustable shocks all around. willwood brake system, ididit steering wheel.4 of 1 rowe racing wheels shaved door handles. Please call Ken of Kathy for details4128216012 $68,000",0
111,q1,5518,d5519,111,7.190390288574131,bmw volk,Chevrolet,Bel Air,"Chevrolet Bel Air 1955 $110,000 Total off frame custom restoration. Car was purchased 2012 from California and completed 2021. Have lots of photos from start to finish .Open to trades Gen 1 or Gen 2 Camaro . Ron Davis aluminum radiator, Dual electric fans, Polished stainless steel water hoses, 427 cubic inch motor, Painted block, Polished aluminum water pump, Billet pulleys, Billet brackets, Holley Quick Fuel carburetor, Polished aluminum intake manifold, Braided fuel lines, Anodized fuel line fittings, Polished aluminum valve covers, Polished fuel pump, Taylor plug wires, Billet plug wire separators, Polished aluminum a/c compressor, Polished alternator, Custom motor mounts, Polished power steering reservoir Custom rack & pinion steering system, Billet distributor, Ceramic coated headers, Polished Hi torque starter, Tubular Aarms, Strange front coil overs, Vented front disc brakes, Wilwood 6 piston calipers, Slotted and drilled rotors, Smoothed and filled firewall, Automatic transmission with billet paddle shifters, Fully Dynamatted interior Three coats of Epoxy on paint Custom painted Art Morrison chassis, Smoothed and filled body, Shaved doors, Custom gauges, 1962 Impala front bucket seats, Polished aluminum Schott wheels, Custom driveshaft, Polished stainless steel exhaust system, Rear fourlink, Strange rear coilovers, Custom painted Ford 9"" rear end, Rear disc brakes, Wilwood rear calipers Slotted & drilled rear rotors, Stainless steel gas tank $110,000",0
148,q1,3638,d3639,148,7.038995550444425,bmw volk,Chevrolet,Bel Air,"Chevrolet Bel Air 1956 $138,500 TRIFIVE, ZZ502 CRATE MOTOR, AUTO, 4LINK, QA1 COILOVERS, RACK AND PINION STEERING, POWER WILWOOD 4WHEEL DISCS, SUPER CLEAN This 1956 Chevrolet Bel Air is an awesome restomod build with EVERYTHING you want.The billet style custom grille and LED halo headlights help this Chevy have a brighter face. And the wide dual exhaust tips, blackedout taillights, lowered stance, and 17inch Schott wheels with extra meaty rear tires all make for an impressively upgraded machine.Those smooth sides mean you get remote door openers. All the best upgradeslike the power windows, power steering, power brakes andice cold air conditioning.The stereo is Kenwood AM/FM/XM touchscreen infotainment with satnav and Bluetooth. It connects to a speaker system with Mosconi amps and Focal speakers. Powered by themighty ZZ502 crate motor, including a Quick fuel fourbarrel carburetor, an Edelbrock aluminum intake, aluminum heads, and long tube headers feeding the dual exhaust. The big power V8 feeds the Gearstar 2004r fourspeed automatic transmission on its way to the limitedslip Currie 9inch rear end. The undercarriage shows how fresh this hardtop is over every inch with a wellmatched maroon presentation. Plus you'll spot upgrades like tubular front Aarms, a fourlink link rear with diagonal link, QA1 adjustable, and Wilwood fourwheel disc brakes. There is a multipage detailed list of all the components it takes to get such an awesome big block Bel Air. $138,500",0
3,q1,2929,d2930,3,8.207489207654175,bmw volk,Volkswagen,Beetle,"Volkswagen Beetle 1976 $16,000 1976 VW Beetle Convertible, converted to carburetor. Everything listed will have less than 100 miles . Entire engine minussheet metal has less than 100 miles on new factory dualport engine. New Carburetor, new tires, new chrome rims, new VW hubcaps, new brake drums and shoes, new clutch, new throwout bearing and pressure plate, new battery and passed Oregon's emission control requirements last month. I have no reason to not believe that the odometer isn't showing original mileage. Car was in deep storage for over ten years and has been resurrected to present condition. Paint isn't original but is without dents or scratches. Convertible top is in good condition and the car has a new car cover. There are several rock dings in the windshield but glass is serviceable. Rust free as far as I can tell, entire car is in very good condition. Thecar is rust free in the spare tire well and the battery compartment. Rebuildable engine with dual port heads minus sheet metal along withthree spare carburetors, two flywheels and assorted parts withan engine stand to mount on a workbench included in the package. Drivers side seat track needs attention. There's always something..... At 75, it's time for the toys to go to new homes....this is a good and serviceable automobile and well worth the investment. $16,000",32
61,q1,3906,d3907,61,7.190390288574131,bmw volk,Volkswagen,Beetle,"Volkswagen Beetle 1967 $18,000 Great condition VW Beetle. Has brand new cushioned vinyl seats, new transmission, and runs very smooth. $18,000",32
178,q1,6396,d6397,178,7.038995550444425,bmw volk,Volvo,122,"Volvo 122 1964 $18,000 B20 engine with ~20k miles.Four speed with overdrive switch on the dash.All of the interior switches are in Swedish.Previous owner had new suspension, shocks struts springs, and sway bar installed! We purchased in 2021 and replaced the alternator, fuel gauge, and added side mirrors. Currently not starting, but has recently.This was my first classic car and I've realized it's not the hobby for me. That being said, she is a beauty and would make an excellent collection starter or addition! $18,000",32
179,q1,6403,d6404,179,7.038995550444425,bmw volk,Volkswagen,Super Beetle,"Volkswagen Super Beetle 1978 $29,500 FROM STICKER 4 CYL, 1.8 LITER FUEL INJECTIOON ENGINE ELECTRIC REAR WINDOW DEFOGGER LEATHERETTE UPHOLSTERY PADDED CONVERTIBLE TOP GLOVE COMPARTMENT LOCK RECLING BUCKET SEATS, FRONT INERTIA , FRONTTYPE SEAT BUILTS DUAL OUTSIDE MIRRORS VANITY MIRROR DAY/NIGHT INSIDE MIRROR RACK AND PINTON STEERING 4SPEED SYNCHRONIZED TRANSMISSON 4 WHEEL INDEPENDANTSUSPENSION HEATER AND DEFROSTER TWOSTAGE FRESH AIR/BLOWER FRONT STABILIZER $29,500",32
9,q1,3306,d3307,9,7.5135951438890025,bmw volk,Honda,S2000,"Honda S2000 2000 $31,750 2000 Honda S2000 Super clean, super fun! VIN: JHMAP1146YT003968 This sporty roadster is in superb,excellent condition inside and out. Extremely wellmaintained. Highly desirable Silverstone Metalliccolor with flawless black leather interior.Only 68,700 miles since new in 2000with no mods, all original. Average of 3,000 miles driven per year. If you're looking for a stand out, driverfocused roadster, this truly unique and highly sought after headturning sports caris for you! The Honda S2000 boasts a front midengine layout, which contributes to the roadster's 50/50 weight distribution. Plus, the engineers at Honda squeezed out as much power as they possibly could fromthe 2.0liter,fourcylinder, VTech engine which produces 240HP. Super high RPMs red line starts at 8,800 with6speed manual transmission making it a hoot to drive! Has the original indash Honda stereo cassette player and remote disc player in trunk. Also comes with original Honda car cover with original red case. Has A/C with a power convertible top that's still in like new condition. Looks fast with top up or down. Honda engines have a terrific track record of reliability and low maintenance. This car is virtually flawless. The Honda mag wheels do not have any road rash. The black leather interior doesn't have a single blemish. Hagerty currently values this model in excellent condition at $42,200, with a concours Honda S 2000 valued at $50,500! These extremely wellengineered Japanese sports cars are in high demand. Don't miss out on this incredible opportunity to own a piece of automotive history contact John at 7404059248 before it's gone! $31,750",25
63,q1,3942,d3943,63,7.190390288574131,bmw volk,Ford,Roadster,"Ford Roadster 1937 $68,900 1937 Ford Custom Roadster. This Trailer Queen has been driven sparinglysince we purchased it and has always been stored in a garage. She is looking for a new home as we are working on a new project car. A clean and clear ID title along with all records and documents come with the sale. More details and photos are available on request. Engine: Chassis: Body: Interior: $68,900",25
