,qid,docid,docno,rank,score,query,brand,model,text,clusters
133,q1,1023,d1024,133,7.038995550444425,bmw volk,Chevrolet,Corvette,"Chevrolet Corvette 1982 $27,950 The Collector Edition Corvette This is a 1982 Collector Edition Corvette, the last of the thirdgeneration Corvettes.The Collector Edition Corvette has special Champagne paint and upholstery, special cloisonn crossedflag emblems on the hood, steering wheel and rear deck, a custom exterior graphics package with shadowstyle graphics on the hood and sides, varying from Champagne to dark brown, along with a special set of 15inch turbinevane aluminum wheels.These are similar to the custom wheels on the 1963 split window coupe. The custom interior includes champagne leather seats, leather wrapped steering wheel, matching carpeted floor mats, smoke colored Ttop removable roof panels, matching carpeted luggage area with black concealment shade.The rear window hatch was engineered with hinged glass to open on the Collector Edition Corvette, rather than a fixed window.Although due to a design flaw, most hinges fail after regular use. Collector Edition Corvettes also has standard equipment that was optional on other 82 corvettes such as electric windows, sixway power drivers seat, power door locks, cruise control, automatic electric antenna, power mirrors, rear window defogger, etc. The 5.7liter, 350 cubic inch, L83 V8 uses Crossfire fuel injection which features two crossmounted 48mm throttlebody injection units. Each throttlebody feeds one bank of cylinders on the v8 engine. This gives it 200 horsepower at 4,200 rpm and 285 lb.ft of torque. During full throttle a solenoid operated door in the hood opened to allow air directly into the air cleaner. Power is sent to the rear wheels through a fourspeed automatic transmission and a limitedslip differential. This car can move. 1982 corvettes came with a fourspeed automatic transmission with overdrive and a lockup torqueconverter clutch breakthrough technology at the time. The collector edition includes standard features such as power steering and brakes, a telescoping and tilting steering wheel, pop up halogen headlamps, full instrumentation such as fuel, oil pressure and temp gages, tachometer, and voltage.Fourwheel independent suspension.Limited slip 2.87 differential. An authentic Collector Edition Corvette will have a 0 as the sixth character in its VIN as this car does.Production was limited to 6,759 cars.This makes this car a rarity. About this Collector Edition Corvette I Bought this Vette here in Maryland in late 1984 from a GM mechanic who loved it but couldnt afford it.It had about 20,000 miles on the odometer. Today its 61,000 miles. For a few years I commuted in it, before making it my weekend ride. Its always been garaged, even at the office. My employer paid for all maintenance and repairs, so nothing needed was missed. To my knowledge, the car has not been in an accident and the engine is original. Restoration Over the past 12 months, Ive invested over $10,000 in restoration. All documented.Including: Additional Features Also included is a custom cotton dust cover and a framed poster of the 1982 Collector Edition Corvette.The dust cover is especially helpful for protecting the car in your garage. I have the original keys, as well as several copies.Plus, the original Ttop leather storage covers, original owners manual and the Chevrolet Corvette service manual are included.See photos. Notice the champagne leather Ttop bracket bag in the back this is for the optional: Roof Panel Carrier.It contains mounting brackets for the Ttops when theyre off the car.I have included photos of the mounting frames.Theyre like new.Ive never seen these offered for sale in like new condition. Not a Perfect Car There is a scratch on the passenger door, which Ive shown in the photos.I had a recent quote of $350 to repaint the door.Ive also highlighted a few other flaws, no matter how trivial, in the photos. Aside from the Air Conditioning, all power features and gauges on this car work.The air conditioning compressor runs, but needs Freon.The rear windows on Collector Edition Corvettes nearly all have problems opening due to the design flaw in the hinges.The release handle on this car does not allow the rear window to open. Want to learn more? Id be glad to put a prospective buyer in touch with both the local Corvette mechanics whove recently worked on the car.Theyre more than happy to speak with you.You are also welcome to hire a mechanic for an independent opinion on the car.Of course, I will answer any questions you might have to the best of my knowledge. Asking Price The asking price is not arbitrary nor based on an inflated opinion of the cars condition.After much study, I set the asking price based on the recent sale of a Collector Edition Corvette, in very similar condition and owner history.That car sold for $29,400 at auction sixteen months ago. Auctions are a strong indicator of true market value.Ive observed at least eight other completed auctions of similar vehicles in that price range in the past two years.Allowing for the air conditioning and the scratch on the door, Ive set my price slightly lower.I believe its a very fair market price for this car. Why you should seriously consider this car Buying this car is like stepping back in time to 1982. Its in showroom condition. I love this car, but Im selling it to make room in my garage for some other projects.Ive thoroughly enjoyed it, but now its time to pass it on to bring joy and someone else. When I sell a car, my name goes on the bill of sale.There should be no surprises for the buyer.Ive made every effort to be candid about the true condition of the car. Every repair expense since Ive owned it is fully documented and indexed in a binder.See photos.These records are included with the car so you can protect your investment. When you buy a car from a dealer, you dont know the history of ownership and care.This dramatically increases your risk.With this car, you have a wealth of information available to you.Including a 40year ownership history.Plus the recent investment of over $10,000 in restoration.All fully documented. A quality classic corvette is an investment.They always go up in value.If you compromise your standards, and buy a low priced, low quality, classic car, youre setting yourself up for failure if you ever choose to sell it.But if you buy a high quantity specimen, like this one, and take good care of it, youll do very well if you decide to sell it.Thats far more important than bargain hunting or haggling for a great deal.Think strategically about the long game for your investment.Dont let this one get away. Summary This is a high end, recently restored collector vehicle.If you want a C3 Collector Edition Corvette in original condition, that you wont have to spend time and money on to drive and enjoy after you invest in it, with a known and documented history, this car wont disappoint you. $27,950",10
180,q1,4304,d4305,180,6.7545590571263245,bmw volk,Chevrolet,Corvette,"Chevrolet Corvette 1977 $32,200 1977 CORVETTE L82 LISTING ID CC1744856 ORIGINAL OWNER The auto for sale is a late production L82 Corvette delivered to a GM dealer in Detroit who immediately assigned it to the body shop where the entire car wasblocked, sanded, and covered with 6 coats of black lacquer paint. When finished, it was gifted to his nephew, a newly minted Medical Doctor. In the interim the Doctor had accepted a position in France, so he took possession, drove to Minneapolis then sold it to me in early November 1977. Since then it has been meticulously maintained for a very demanding Mechanical Engineer. Effectively I am the original owner although technically the car has been mine for 46 years less the few weeks it was in transit. In Minneapolis the car was stored in a heated garage from October to May every year until 1986 when it was relocated to California and then to Arizona, where it has been garaged ever since. The 1977 Corvette is a beautiful automobile, but this model year also had some significant disappointments. The 1977 Corvette is a 3500pound sport car designed to operate with 350+ horsepower. By 1977 the L82 engine output had been reduced by almost 150 HP due to emission controls. in my opinion, this model with 210 HP is underpowered and, even with the California Emission Certification option installed, it still failed to meet California or Canadian emission standards. The shortcoming was addressed by Twin City Racing in Minneapolis who Installed an Edelbrok performance intake manifold and in 1984 after a 2year year search installed a factory set of 2.17 Chevy heads. Estimated improvement 100115 HP, several years later a custom exhaust system was fabricated and installed. The factory double y single cat converter system was replaced with larger diameter straight pipes utilizing exhaust routing layouts designed into the Corvette frame. Another catalytic converter and twin high bypass mufflers completed the design. The results were amazing! Emissions for hydrocarbons and carbon dioxide, idle and loaded, were roughly 90% lower than Arizona mandates. A copy of the last emission test is attached. As this Corvette sits today, it has roughly 350 horsepower, was licensed in California for 14 years and had noproblempassing California emission protocols. If the buyer prefers a Survivor car most original factory parts are like new, including AM/FM stereo radio, clock, radiator tanks, set of 2.02 heads, intake manifold and other spare parts. It was last repainted in 1997. In 2004 Mike Scott, a Corvette judge and owner of Corvette Corrections in Anaheim California appraised the car for not less than $20,000 in 2023 dollars. In the appraisal he also said this is one of the nicest 1977 Corvettes I have inspected. It is also one of the rarest by color combination. Black exterior and smoke gray leather interior. This car has been kept in very good condition inside and out. This vehicle is also highly optioned. A copy of the appraisal is attached. Maintenance log is available. $32,200",10
44,q1,3211,d3212,44,7.190390288574131,bmw volk,Chevrolet,Corvette Stingray,"Chevrolet Corvette Stingray 1970 $34,879 This classic corvette stingray elicits lots of looks on the road. It is in mint condition. New brakes, headlamps, battery, alternator and convertible top. $34,879",1
57,q1,3656,d3657,57,7.190390288574131,bmw volk,Chevrolet,Blazer,"Chevrolet Blazer 1991 $34,000 Last year of the removable hardtop Blazers. Has a new Softtopper canvas top on now. Hard top is included, it is in excellent condition. This was originally a California forest service vehicle, original Ansul fire extinguisher is included. It is absolutely rust free. Newer paint, fresh tires, new houndstooth seat upholstery, new rubber floor mat. Telescope and tilt steering. Air conditioning recently serviced. Rebuilt transmission. Chrome is in excellent condition. $34,000",1
80,q1,4709,d4710,80,7.190390288574131,bmw volk,Triumph,TR6,"Triumph TR6 1974 $23,000 Beautiful1974 Triumph TR6 convertible. Great driving car with only 45,000 miles. Clean title. Six cylinder engine, dual carbs and tight steering provide lots of power and handling for those twisty country roads. The interior is clean with no tears or carpet wear. It has a roll bar and custom wind deflector which can be removed. The rear window is clear and the top is in good condition. The radio has a USB connection for phone charging or playback through the radio. Also included is an old classic picnic basket for a real nostalgic look. Includes car cover. $23,000",12
122,q1,5902,d5903,122,7.190390288574131,bmw volk,Triumph,TR6,"Triumph TR6 1976 $32,500 New black convertible top. $32,500",12
134,q1,1277,d1278,134,7.038995550444425,bmw volk,Triumph,TR6,"Triumph TR6 1974 $20,000 1974 Triumph TR6, rebuilt engine in 2015, brand new transmission, car has been professionally maintained at shop specializing in British sports cars. No rust. Could use some touch up paint but otherwise in excellent condition mechanically and exterior $20,000",12
135,q1,1313,d1314,135,7.038995550444425,bmw volk,Mercedes-Benz,280SL,"MercedesBenz 280SL 1970 $129,900 This 1971 MercedesBenz 280SL was delivered new to W.I Simonson Mercedes Santa Monica, CA, and this Pagoda lived in Southern California its whole life. First owner was a Lawyer who took excellent care of this vehicle. Mercedes stamped records booklet and always pampered. Second owner was a businessman who was in the nuts & bolts business acquired this vehicle in 1997 and had been the owner since. Many detailed serviced history and a full restoration was completed in the early 2000's.This vehicle is now being listed from a private collection. Factory inner fenders with correct spot welds and factory fender notching. Powered by a serviced 2.8liter inlinesix mated to a fourspeed automatic transmission, the car is finished in Signal Red over black leather upholstery. Equipment includes a color matching removable hardtop, power steering, air conditioning, a Becker Europa AM/FM stereo, data card, Auxiliary Bench and Bumper Over Riders This W113 is now offered with a window sticker, manufacturers literature, service records, a hardtop stand, a tool roll, two keys. Please feel free to call/text 6216883. $129,900",1
22,q1,963,d964,22,7.190390288574131,bmw volk,Pontiac,Firebird,"Pontiac Firebird 1968 $46,000 This 1968 Pontiac Firebird Convertible was bodyon restored in 2006 and remains in great condition. It hasmany new parts including rebuilt Pontiac 400 CID Long Block, ram air style hoodwith builtin tachometer, a Hurst shifter, Rally II wheels with redline tires, separate set of Rocket Booster Chrome rims with Kumho tires, and much more.Car was purchased in 2013. There was no documentation from the restoration orengine rebuild. The drive train is not matching numbers. About 1,000 miles put on the car since 2013. Engine: 400 CID Pontiac Long Block, 400 HP Transmission: 4 Speed Manual Rear end: 4:11 gearratio. Engine RPM 2,900 on the hood tach at 70 MPH Trim Tag Info: Build date 08D , Paint Code C1 Trim Code: Black Vinyl Interior Miles: 77,450 Items included with car: Convertible boot, Warranty Book , Original Owner's Manual, set of Rally IIRims and redline tires. Equipment: Power Front Disc Brakes,Power Steering, Ram Air Hood, Hood Mounted Tachometer, Hurst Shifter, AM/FM/Bluetooth radio. $46,000",9
36,q1,3081,d3082,36,7.190390288574131,bmw volk,Mercedes-Benz,320,"MercedesBenz 320 1995 $8,750 no accidents, all interior clear and clean with new leather where necessary, total respray in original white, new leather on armrest, all hub caps refurbished. New radio with blue tooth, etc $8,750",8
115,q1,5838,d5839,115,7.190390288574131,bmw volk,Volvo,P1800E,"Volvo P1800E 1971 $29,000 The Vintage Volvo P1800E: A Blend of Elegance and Legacy Step back in time and feast your eyes upon the vintage Volvo P1800E, an embodiment of Scandinavian craftsmanship, robust engineering, and timeless aesthetics. Introduced as the next iteration in 1970, the P1800E stands out not just for its unique features but also its unparalleled presence in the world of classic cars. Elegant Design Under the Hood A Rarity to Cherish Iconic Legacy Classic Yet Contemporary Volvo P1800E isn't just a car; it's an emotion. It stands as a testament to a bygone era when cars were more than just a mode of transport; they were an extension of one's personality, a piece of art to be celebrated, and a legacy to be passed down. Whether you're an automotive enthusiast, a collector, or someone who appreciates fine design, the P1800E is a treasure that promises to deliver joy with every drive. $29,000",30
127,q1,6071,d6072,127,7.190390288574131,bmw volk,Ford,Model T,"Ford Model T 1929 $19,000 1929 Madel T Doctors Coupe $19,000",9
137,q1,2025,d2026,137,7.038995550444425,bmw volk,Pontiac,Firebird Trans Am,"Pontiac Firebird Trans Am 1994 $26,000 $26,000",9
144,q1,3183,d3184,144,7.038995550444425,bmw volk,Volvo,PV544,"Volvo PV544 1962 $11,000 1962 Volvo PV544 B18 This car has been in my family since my dad bought it in the early 70's. I still use it to go to work. It runs and handles well on either country roads or the open highway. The vinyl interior was redone in the 90's and a set of 70's era Volvo seats were installed. I still have the original seats for you collectors. It has been painted twice since we owned it. The last time in 2005. Theengine was rebuilt about 10 years ago. I had the SU carburetors rebuilt this year, along with the distributor. I also have a lot of extras: Rebuilt B18 Engineon a stand;1completeand 1in parts Transmissions; 2sets of SU Carburetors; 2 Radiators; Generator; Top End Engine Parts; Lights; Gauges; 2 original Tire Jacks; Suspension Parts; Trim and Several Boxes of More Volvo Stuff. We have driven and loved this car for over 50 years. Many of my cousins and dear friends learned to drive in it. I am looking for someone to buy it, restore it and enjoy it as my family has for so long. Patrick Grass Valley, California $11,000",30
151,q1,3894,d3895,151,7.038995550444425,bmw volk,Nissan,300ZX,"Nissan 300ZX 1991 $25,750 Rare! 1991 Twin Turbo 300ZX convertible in beautiful condition! Super sharp! Super rare! 1991 300ZX twin turbo, 5 speed manual convertible! Runs great, beautiful inside and out! No rust! 129,000 original miles. This is an original twinturbocharged Z32 and boasts 300 horsepower and 283 lbft of torque, adjustable suspension and HICAS fourwheel steering. Rare Richard Straman aftermarket convertible conversion as featured in 1991 edition of Car&Driver magazine. Custom ""Z"" embroidered leather seats and matching floor mats, with power windows, power seats, and antifog power mirrors. Newly installed Sony touch screen sound system with Bose speakers. Must see in person to appreciate! Brand new custom top and refreshed interior looks like new. Beautiful exterior but there are some flaws and nicks in the original paint. Clean Carfax. No rust. No accidents. Well maintained. Hagerty's valuation for the standard Ttops version is impressive: Concours $59,500 Serious inquiries only! $25,750, obo! Thanks for looking, John $25,750",8
158,q1,4915,d4916,158,7.038995550444425,bmw volk,Pontiac,Firebird Trans Am,"Pontiac Firebird Trans Am 1998 $22,900 1998 Pontiac Trans Am Low Mileage and Performance Upgrades Brand New SP555RII Tires $24,900 Are you ready to own a piece of American muscle car history? This 1998 Pontiac Trans Am is a true gem, boasting only 57,950 miles on the odometer and a list of carefully selected performance modifications that will make your heart race. Dynoing in at328 horsepower of pure excitement, this Trans Am is not for the faint of heart. Looking for a new loving home for this monster. Key Features: Performance Upgrades Include: Brand New NTI555RII Tires: SLP Longtube Headers: SLP 3"" Y Pipe With High Flow Cats MTI Induction Lid: Subframe Connectors: Exterior and Interior: This Trans Am features the iconic Firebird styling, with sleek lines and aggressive contours that turn heads wherever you go. The glossy black paint is in goodcondition, reflecting the care this car has received over the years. Inside, you'll find a wellmaintained, driverfocused cabin that includes comfortable seating and modern conveniences. Additional Features: Maintenance and Care: This Pontiac Trans Am has been meticulously maintained and cared for throughout its life. Garage kept and ran twice a year to ensure that it runs smoothly and reliably. Why Buy This 1998 Pontiac Trans Am? Don't miss your chance to own this outstanding 1998 Pontiac Trans Am. It's a true enthusiast's dream, combining low mileage, performance upgrades, and classic American muscle. $22,900",9
54,q1,3464,d3465,54,7.190390288574131,bmw volk,Chevrolet,C10,"Chevrolet C10 1972 $25,999 1972 Chevy C10 Cheyenne factory 350 V8 engine automatic transmission runs and drives excellent. New brakes, new fuel tank, and new bedliner.Call now! 9548719299 $25,999",31
89,q1,4953,d4954,89,7.190390288574131,bmw volk,Ford,Model A,"Ford Model A 1930 $31,999 MS MOTORS LLC IS PROUD TO PRESENT TO YOU THIS BEAUTIFUL 1930 FORD MODEL A COUPE! 1930 FORD MODEL A COUPE *METAL BODY $31,999",31
145,q1,3266,d3267,145,7.038995550444425,bmw volk,Ford,Customline,"Ford Customline 1955 $25,995 $25,995",31
157,q1,4804,d4805,157,7.038995550444425,bmw volk,Chevrolet,Bel Air,"Chevrolet Bel Air 1957 $79,999 1957 Chevrolet 210. $79,999",31
174,q1,6207,d6208,174,7.038995550444425,bmw volk,Chevrolet,210,"Chevrolet 210 1955 $25,000 1955 Chevy Model 210 Station Wagon Rebuilt as daily driver Rebuilt Motor Roof Rack with Surfboard Converted to Disc Brakes Powder Coated Wheels, New Tires & Hubcaps VHX ""Dakota"" Gauges New Exhaust System New Springs, shocks & Front end parts. $25,000",31
131,q1,6244,d6245,131,7.190390288574131,bmw volk,Toyota,Land Cruiser FJ40,"Toyota Land Cruiser FJ40 1971 $30,000 1971 Toyota Land Cruiser FJ40 with three speed on the column with two and a half inch shackle lift, with four like new BF Goodrich 31 x 10.50 R15 LT tires. Installed two 1973 Land Cruiser bucket seats, with center console. Rear bench seat for two with seatbelts. Installed new turn signal switch lever, LED tail lights, and running lights. Also installed Roll Bar. Recent work done, rear main crankshaft seal, oil pan replaced, new steering stabilizers, and four ""Rough Country "" shocks. Includes engine repair manual and chassis/body manual, with supplement manuals for both. Comes with replacement hard to find body parts passenger side panel and rear top bracket with bolts and weather striping. Many other hard to find parts like, new carburetor, four brake drums turned, and too many to list. Runs good. I am the second owner, I bought it from my Dad in 1979. Ten years ago I was in the process of fixing her up, when I became disabled. $30,000",28
155,q1,4127,d4128,155,7.038995550444425,bmw volk,Toyota,FJ Cruiser,"Toyota FJ Cruiser 2014 $50,000 TOYOTA FJ CRUISER TRAIL TEAMS ULTIMATE EDITION + ALL TRD EXTRAS This outstanding one owner, low mileage FJ Cruiser is one of only two thousand five hundred Trail Teams Ultimate Edition models made in 2014. This variant takes the already capable FJ Cruiser to a whole new level of comfort and styling. The offroad prowess is furthered by the addition of all available TRD extras . The upgraded custom leather interior of this vehicle is in like new condition with no signs of damage and is odor and stainfree. The powerful two hundred and sixty horsepower V6 double overhead camshaft engine runs very well indeed and has been meticulously maintained from new. You wont find another FJ Cruiser quite like this one. Over $10K in upgrades and TRD extras. Vehicle report available upon request. Sale will include all maintenance records since date of purchase from dealership. Features: 46,458 Miles, Heritage Blue, TRD ColdAir intake, TRD Stainless Steel Exhaust, TRD SkidPlate, TRD RockRails + all four steps, TRD Bilstein Gas Shocks, TRD Big Brake Racing Package, Toyota OEM Trailer Hitch, Brushguard Bumper, Custom Leather Seats, 5 TRD 16 Rims, 5 new Nitto Terra Grappler Tires , TRD Crawl Control, Solid Aluminum AirDam. If youre looking for the Trail Teams Ultimate Edition with all OEM Toyota TRD upgrades, this is the one for you. $50KOR BEST OFFER All offers considered. Contact us for more information or to schedule a test drive and receive a copy of the vehicle report. https://2014fjcruisertrailteamsforsale.com/ $50,000",28
166,q1,5521,d5522,166,7.038995550444425,bmw volk,Toyota,Land Cruiser,"Toyota Land Cruiser 1995 $44,000 1995 HZJ75 Toyota Land Cruiser Right Hand Drive imported from Japan. 4.2L 1HZ Diesel InlineSix 5 SpeedManual Transmission Only 4K Original Miles. 4x4 DualRange Transfer Case. PTO access. Originally a Japanese Firetruck that has been converted. Original Engine and Transmission Does not have Power Steering. FauxLeather in extremelygood condition, rear seats still have plastics covering them. High Roof Body OME Suspension New Paint TRD Cement color Ironman Front Bumper SCS F5 rims, new Falken Wildpeak $44,000",28
71,q1,4224,d4225,71,7.190390288574131,bmw volk,Plymouth,Fury III,"Plymouth Fury III 1966 $4,000 1966 Plymouth Fury III, Needs motor and transmission, New bumpers and parts come with car, Very straight body. $4,000",21
75,q1,4488,d4489,75,7.190390288574131,bmw volk,Chevrolet,Impala,"Chevrolet Impala 1966 $9,000 Original owner Arizona car, No Rust, Engine and Transmission was rebuilt at 93,000 miles, 400 small block .030 over, V8, 350 Turbo Transmission, Factory A/C, Newer upholstery restored to factory colors. $9,000",21
78,q1,4600,d4601,78,7.190390288574131,bmw volk,Ford,Galaxie 500,"Ford Galaxie 500 1966 $45,000 1966 Ford Galaxie Fastback Custom! One of a kind street car! Looks good, sounds good, and out runs most on the street. 548 BBF Please call Jeremi for details2013101 $45,000",21
119,q1,5892,d5893,119,7.190390288574131,bmw volk,Plymouth,Cuda,"Plymouth Cuda 1970 $129,000 1970 Plymouth Cuda UCode ONE OF618! Built in the L.A. Plant on Feb. 4, 1970 375 H.P. 4404 BBL Engine ORIGINAL ENGINE! 727 Slapstick Automatic Transmission SureGrip rearend with 3.55 gears Factory Air Conditioning Factory FC7 Paint, In Violet Factory White interior with bucket seats and console. Rallye Instrument Cluster 3Speed Wipers Lighting package w/fender mounted turn signals. 3100 miles on 15 year, Professional, complete rotisserie restoration. 100 plus photo documentation. Factory white vinyl top and body side moldings deleted when restored. Car is laser straight! Paint is in perfect condition with no chips or blemishes. Chrome and trim are all near perfect! $129,000",21
